{
  "name": "Push/Pull/Legs",
  "context": "Intermediate lifter, training 6 days per week, focused on hypertrophy with slight strength emphasis on the A days.",
  "description": "6-day PPL program running two full cycles per week with slight volume variation between A and B days.",
  "cycle": [
    "Push A",
    "Pull A",
    "Legs A",
    "Push B",
    "Pull B",
    "Legs B",
    { "type": "rest" }
  ],
  "workouts": [
    {
      "name": "Push A",
      "focus": "push",
      "exercises": [
        {
          "exerciseRef": "bench_press",
          "sets": 4,
          "reps": { "min": 5, "max": 8 },
          "rest": { "workSeconds": 150, "warmupSeconds": 60 },
          "setTypes": ["warmup", "work", "work", "work"]
        },
        {
          "exerciseRef": "overhead_press",
          "sets": 3,
          "reps": { "min": 8, "max": 12 },
          "rest": { "workSeconds": 120 }
        },
        {
          "exerciseRef": "incline_dumbbell_press",
          "sets": 3,
          "reps": { "min": 10, "max": 15 },
          "rest": { "workSeconds": 90 }
        },
        {
          "exerciseRef": "cable_fly",
          "sets": 3,
          "reps": { "min": 12, "max": 20 },
          "rest": { "workSeconds": 60 }
        },
        {
          "exerciseRef": "lateral_raise",
          "sets": 4,
          "reps": { "min": 15, "max": 25 },
          "rest": { "workSeconds": 60 }
        },
        {
          "exerciseRef": "tricep_pushdown",
          "sets": 3,
          "reps": { "min": 12, "max": 15 },
          "rest": { "workSeconds": 60 }
        },
        {
          "exerciseRef": "overhead_tricep_extension",
          "sets": 3,
          "reps": { "min": 12, "max": 15 },
          "rest": { "workSeconds": 60 }
        }
      ]
    },
    {
      "name": "Pull A",
      "focus": "pull",
      "exercises": [
        {
          "exerciseRef": "deadlift",
          "sets": 3,
          "reps": { "min": 4, "max": 6 },
          "rest": { "workSeconds": 180, "warmupSeconds": 90 },
          "setTypes": ["warmup", "work", "work"]
        },
        {
          "exerciseRef": "barbell_row",
          "sets": 4,
          "reps": { "min": 6, "max": 10 },
          "rest": { "workSeconds": 120 }
        },
        {
          "exerciseRef": "lat_pulldown",
          "sets": 3,
          "reps": { "min": 10, "max": 15 },
          "rest": { "workSeconds": 90 }
        },
        {
          "exerciseRef": "cable_row",
          "sets": 3,
          "reps": { "min": 10, "max": 15 },
          "rest": { "workSeconds": 90 }
        },
        {
          "exerciseRef": "face_pull",
          "sets": 3,
          "reps": { "min": 15, "max": 25 },
          "rest": { "workSeconds": 60 }
        },
        {
          "exerciseRef": "bicep_curl",
          "sets": 4,
          "reps": { "min": 10, "max": 15 },
          "rest": { "workSeconds": 60 }
        }
      ]
    },
    {
      "name": "Legs A",
      "focus": "legs",
      "exercises": [
        {
          "exerciseRef": "squat",
          "sets": 4,
          "reps": { "min": 5, "max": 8 },
          "rest": { "workSeconds": 180, "warmupSeconds": 90 },
          "setTypes": ["warmup", "work", "work", "work"]
        },
        {
          "exerciseRef": "romanian_deadlift",
          "sets": 3,
          "reps": { "min": 8, "max": 12 },
          "rest": { "workSeconds": 120 }
        },
        {
          "exerciseRef": "leg_press",
          "sets": 3,
          "reps": { "min": 12, "max": 15 },
          "rest": { "workSeconds": 90 }
        },
        {
          "exerciseRef": "leg_curl",
          "sets": 3,
          "reps": { "min": 12, "max": 15 },
          "rest": { "workSeconds": 90 }
        },
        {
          "exerciseRef": "leg_extension",
          "sets": 3,
          "reps": { "min": 15, "max": 20 },
          "rest": { "workSeconds": 60 }
        },
        {
          "exerciseRef": "calf_raise",
          "sets": 5,
          "reps": { "min": 15, "max": 20 },
          "rest": { "workSeconds": 60 }
        }
      ]
    },
    {
      "name": "Push B",
      "focus": "push",
      "exercises": [
        {
          "exerciseRef": "overhead_press",
          "sets": 4,
          "reps": { "min": 5, "max": 8 },
          "rest": { "workSeconds": 150, "warmupSeconds": 60 },
          "setTypes": ["warmup", "work", "work", "work"]
        },
        {
          "exerciseRef": "bench_press",
          "sets": 3,
          "reps": { "min": 8, "max": 12 },
          "rest": { "workSeconds": 120 }
        },
        {
          "exerciseRef": "dumbbell_shoulder_press",
          "sets": 3,
          "reps": { "min": 10, "max": 15 },
          "rest": { "workSeconds": 90 }
        },
        {
          "exerciseRef": "lateral_raise",
          "sets": 4,
          "reps": { "min": 15, "max": 25 },
          "rest": { "workSeconds": 60 }
        },
        {
          "exerciseRef": "cable_fly",
          "sets": 3,
          "reps": { "min": 12, "max": 20 },
          "rest": { "workSeconds": 60 }
        },
        {
          "exerciseRef": "tricep_dip",
          "sets": 3,
          "reps": { "min": 8, "max": 15 },
          "rest": { "workSeconds": 90 }
        },
        {
          "exerciseRef": "skull_crusher",
          "sets": 3,
          "reps": { "min": 10, "max": 15 },
          "rest": { "workSeconds": 60 }
        }
      ]
    },
    {
      "name": "Pull B",
      "focus": "pull",
      "exercises": [
        {
          "exerciseRef": "pull_up",
          "sets": 4,
          "reps": { "min": 6, "max": 10 },
          "rest": { "workSeconds": 120 }
        },
        {
          "exerciseRef": "barbell_row",
          "sets": 3,
          "reps": { "min": 8, "max": 12 },
          "rest": { "workSeconds": 120 }
        },
        {
          "exerciseRef": "lat_pulldown",
          "sets": 4,
          "reps": { "min": 10, "max": 15 },
          "rest": { "workSeconds": 90 }
        },
        {
          "exerciseRef": "single_arm_dumbbell_row",
          "sets": 3,
          "reps": { "min": 10, "max": 15 },
          "rest": { "workSeconds": 90 }
        },
        {
          "exerciseRef": "face_pull",
          "sets": 3,
          "reps": { "min": 15, "max": 25 },
          "rest": { "workSeconds": 60 }
        },
        {
          "exerciseRef": "hammer_curl",
          "sets": 3,
          "reps": { "min": 10, "max": 15 },
          "rest": { "workSeconds": 60 }
        },
        {
          "exerciseRef": "incline_dumbbell_curl",
          "sets": 3,
          "reps": { "min": 10, "max": 15 },
          "rest": { "workSeconds": 60 }
        }
      ]
    },
    {
      "name": "Legs B",
      "focus": "legs",
      "exercises": [
        {
          "exerciseRef": "romanian_deadlift",
          "sets": 4,
          "reps": { "min": 6, "max": 10 },
          "rest": { "workSeconds": 150, "warmupSeconds": 90 },
          "setTypes": ["warmup", "work", "work", "work"]
        },
        {
          "exerciseRef": "bulgarian_split_squat",
          "sets": 3,
          "reps": { "min": 8, "max": 12 },
          "rest": { "workSeconds": 90 }
        },
        {
          "exerciseRef": "hip_thrust",
          "sets": 4,
          "reps": { "min": 10, "max": 15 },
          "rest": { "workSeconds": 90 }
        },
        {
          "exerciseRef": "leg_curl",
          "sets": 4,
          "reps": { "min": 10, "max": 15 },
          "rest": { "workSeconds": 90 }
        },
        {
          "exerciseRef": "leg_extension",
          "sets": 3,
          "reps": { "min": 15, "max": 20 },
          "rest": { "workSeconds": 60 }
        },
        {
          "exerciseRef": "calf_raise",
          "sets": 5,
          "reps": { "min": 15, "max": 20 },
          "rest": { "workSeconds": 60 }
        }
      ]
    }
  ]
}
